Jp,En,speaker
"あ！　あんたに言おうと思ってたんだ
アルケミストに入門してから、もう結構なるだろ","Ah! I've been meaning to tell you...
You've been an Alchemist for some time now, right?",Renton
"ほら、今最も実力のある錬金術師――
《メルゴダ》のテオドールだっけ","I mean, the most competent Alchemist
around right now is Theodor from…
Mergoda, I'm pretty sure?",Renton
"そろそろ、その人のとこでもっと
上級の技について学んでみないか？
神殿は公式にはアルケミストを認めてないんだが
俺は結構あんたに向いてると思うんだよな","Hey, how's about learning some advanced
Alchemist techniques from him soon?
The Temple won't officially oversee this Vocation,
but I personally think it suits you well.",Renton
"ほら、あんたがアルケミストを究めたら
それはレスタニアの歴史にとっても大きな一歩だろ？
なんせ禁術の復活なんだから！","See, if you were to master Alchemy,
you'd be making history in Lestania, right?
After all, you're reviving the forbidden arts!",Renton
"これは訓練官としての依頼でもある
やってくれるよな？","This is also a request as the training officer.
You'll do it, right?",Renton
"ほらほら、あの件――
《メルゴダ》のテオドールに会うんだぞ","Come on now, don't forget!
You're heading off to see Theodor in Mergoda!",Renton
"錬金術復活に立ちあった訓練官！
後にも先にも、そんなの俺だけだな！
絶対に","To be the trainer who witnesses
the revival of Alchemy itself!
No one else, ever, will have this story to tell!
Without a doubt!",Renton
"おや、わたしに用かな
世間話をしに来たわけではないようだね","Oh? Need something of me, do you?
I gather it's not merely for idle chatter.",Theodor
"詳しく話を聞こうか
どうやらわたしにとっても興味深い
話題のようだ","Let's hear it, then.
You've piqued my interest.",Theodor
