"Jp","En","english","speaker"
"覚者殿！
バシアス殿から、珍しい素材が取れる
冒険スポットをお伝えするようにと
申し付けられております","Master Arisen! Ser Bacias has instructed me
to inform you of an Adventure Spot where
rare materials can be obtained.","","Youssef"
"ウルテカ山岳の北部に《火垂れ山拝竜院》と呼ばれる
施設があるのはご存知でしょうか？","Are you aware of the facility called
《Firefall Mountain Dragon Temple》
in the northern Urteca Mountains?","","Youssef"
"今では、すっかり魔物の手に堕ちてしまっていますが
そう悪いことばかりではないようで――
魔物の活動によってか
珍しい素材が取れるスポットになっているようです","It has now completely fallen into the hands
of monsters, but it seems not all is lost...
Due to their activity, rare materials
have become bountiful there.","","Youssef"
"しかし、その危険さゆえに最近は
近づこうとする人さえ見かけません――
覚者殿、もし採集に出向かれるのなら
中の状態を確認してきてはいただけないでしょうか？","However, with the many dangers it holds,
lately there are none who dare approach it...
Master Arisen, should you go a gathering trip,
could you report the conditions inside?","","Youssef"
"ウルテカ山岳の北部にある《火垂れ山拝竜院》です
危険さゆえに最近は
近づこうとする人さえ見かけません――","This is the 《Firefall Mountain Dragon Temple》
in the Northern Urteca Mountains.
I've rarely seen someone brave enough to come visit
with it being so dangerous and here.","","Youssef"
"もし採集に出向かれるのなら
中の状態を確認して
私にご連絡いただけないでしょうか？","If you're going to collect some materials,
could you check the state inside
and contact me afterwards?","","Youssef"
"覚者殿、ご無事のお戻りなにより――
それで、中の様子はいかがでしたか？","Master Arisen, your safe return is a relief...
So, how was the state inside?","","Youssef"
"危険な魔物がそこかしこで徘徊していると――
思ったよりも中の様子はおぞましいものに
なっているようですね
注意喚起をしておかねば――","Dangerous monsters are roaming everywhere...
The state inside is more dangerous than expected.
We must issue a warning...","","Youssef"
"しかし、我々ではどうしようもなくとも
覚者殿であれば、上手く利用なさることでしょう
ご協力いただきありがとうございました","Even if we can do nothing about the monsters,
You could make good use of the location,
Master Arisen. Thank you for your cooperation.","","Youssef"
