Jp,En,english,speaker
"覚者様、巨岩の爆破処理は
滞りなく済んでおります
――ご出発の準備はよろしいでしょうか","Ser Arisen, the large stone demolition
has been completed without any issues.
Are you ready to depart?",,Bacias
"火竜様の竜力、そしてアッカーシェランの象徴である
この火垂れ山を取り戻すためにも――
今一度、お力をお貸しください","To reclaim Firefall Mountain, the symbol of
Acre Selund and the Dragon Force of
Lord Fire Dragon, please lend me your strength.",,Bacias
"覚者様、ご出発の準備はよろしいでしょうか
火竜様の竜力、そしてアッカーシェランの象徴である
この火垂れ山を取り戻すためにも――
今一度、お力をお貸しください","Ser Arisen, are you prepared to depart?
To reclaim Firefall Mountain, the symbol
of Acre Selund and the Dragon Force of
Lord Fire Dragon, we beseech your aid once more.",,Bacias
"覚者様、エリアマスターとして
そしてこの火垂れ山の門を守る門番として
心から感謝申し上げます――","Ser Arisen, as the area master and
as the gatekeeper of Firefall Mountain's gate,
I sincerely thank you.",,Bacias
"火垂れ山から闇の魔法を操るドラゴンを
排除できたからといって
アッカーシェランより全ての脅威が
去ったわけではありませんが――","Eliminating the dragon that manipulates
dark magick from Firefall Mountain
may not mean that all threats have
left Acre Selund, but...",,Bacias
"しかし、火垂れ山を取り戻せたことは
これからのアッカーシェランの未来に
まさしく希望の火が灯るような――
そういったもののように感じます","Being able to recover Firefall Mountain
feels like a spark of hope for
the future of Acre Selund...
It feels like we can finally move forward.",,Bacias
"出発の準備が整ったら
私にお声をお願いいたします","Please let me know when
you are ready for departure.",,Bacias
