old,speaker,english,speaker,english,speaker
"ボクの真の"相棒"がこの手に戻った今
もはやこの奪還作戦の成功は
約束されたも同然！",Sonel,,Sonel,,Sonel
""約束が約束されている"と言っても
過言ではないね！",Sonel,,Sonel,,Sonel
"さぁ、ボクが今までずっと温めてきた
"とっておきの作戦"で
オークくんたちに引導を渡してやろう！",Sonel,,Sonel,,Sonel
"慌てふためいて取り乱す姿が
瞼の裏にくっきり映って見えるよ
目を開けていてもね！",Sonel,,Sonel,,Sonel
あっ,Sonel,,Sonel,,Sonel
あっはっ,Sonel,,Sonel,,Sonel
あっはっはっ,Sonel,,Sonel,,Sonel
あっはっはっは！,Sonel,,Sonel,,Sonel
"隊長！　ついにここまで来たよ
さあ最後の作戦だ！",Sonel,,Sonel,,Sonel
"――あれ、ないぞ――
あれ――そんな馬鹿な――
僕に限ってそんなハズは――",Sonel,,Sonel,,Sonel
"あれ、まずい――まずいぞ――
アレがないと、もう終わりだ――
落ち着け――いつだ――どこでだ――",Sonel,,Sonel,,Sonel
"――ああ、分からない
ダメだダメだ――
――隊長、ひとつ頼みがある
実に簡単なヤツだ",Sonel,,Sonel,,Sonel
"この"とっておきの作戦"には
例の"アレ"が欠かせなくてね",Sonel,,Sonel,,Sonel
"この作戦のキーと言ってもいいものだ
というか"キーそのもの"なんだけど",Sonel,,Sonel,,Sonel
つまり、ものすごく簡潔に説明すると――,Sonel,,Sonel,,Sonel
作戦に使う《鍵》をなくしてしまった,Sonel,,Sonel,,Sonel
"そういうことになるだろうね！
あっはっはっは！　こいつはケッサクだ！",Sonel,,Sonel,,Sonel
"この城の裏門の《鍵》なんだけどね
今日という日が来るまで
ずっと肌身離さず持っていると思っていた",Sonel,,Sonel,,Sonel
"だけど、いつの間にか
どこかに落っことしてしまってたようだ",Sonel,,Sonel,,Sonel
"うーん――
そうだなぁ、ムスタファとかいいんじゃない？",Sonel,,Sonel,,Sonel
""白髪にヒゲ"と言ったら
もう物知りさんで決まり！",Sonel,,Sonel,,Sonel
"なにせもう一滴も覚えてないからね
ヤケクソさ！",Sonel,,Sonel,,Sonel
"ふむ、これは覚者殿
何かご用でも――",Mustafa,,Mustafa,,Mustafa
"え？　ソネル様がヤケクソで私を指名？
はぁ、いまいち事情が呑み込めませんが――",Mustafa,,Mustafa,,Mustafa
"作戦に使う裏門の《鍵》――ですか
それをなくされてしまい
ヤケクソになられている、と",Mustafa,,Mustafa,,Mustafa
"そうですな――
確かに"白髪にヒゲ"ではありますが
私も失せ物に関しては――",Mustafa,,Mustafa,,Mustafa
そう言えば、"失せ物"で思い出したことが,Mustafa,,Mustafa,,Mustafa
"数日前のことですが
食堂で起きた妙な事件の話を耳にしましてな",Mustafa,,Mustafa,,Mustafa
"「シチュー鍋の"かき混ぜ棒"が消える」
というもので、食堂にいるアクギスから
聞いたのですが",Mustafa,,Mustafa,,Mustafa
ある晩、食堂で翌日の仕込みをしていたところ――,Mustafa,,Mustafa,,Mustafa
"何者かがフラッとやって来て
暗闇の中何やらシチュー鍋のところで
ゴソゴソとやっておったそうで",Mustafa,,Mustafa,,Mustafa
"慌ててアクギスが駆け寄ったときには
その人物も、かき混ぜ棒も消えておったそうじゃ",Mustafa,,Mustafa,,Mustafa
"私もその事件に少々興味を持ちましてな
展望城内をあちこち調べて回ったのです
するとなぜか――",Mustafa,,Mustafa,,Mustafa
"それと思しき棒を
展望城入り口の門兵が持っておりまして
どこで手に入れたか問い質したのですが",Mustafa,,Mustafa,,Mustafa
"「"重要な作戦の棒切れ"だから答えられない」
の一点張りでしてな――困ったものです",Mustafa,,Mustafa,,Mustafa
"そもそも犯人なら
堂々と持っていることもないでしょうし
謎めいた事件として迷宮入りしそうですな",Mustafa,,Mustafa,,Mustafa
"――ああ、すっかり話が反れてしまいましたな
お忙しい覚者殿を引き留めてしまって申し訳ない",Mustafa,,Mustafa,,Mustafa
"あ！　隊長じゃないか！
こんにちは！
ずいぶんと久しぶり！",Sonel,,Sonel,,Sonel
"ちょっと見ない間に大きくなったみたいだね！
いや、ボクが小さくなったのかな？",Sonel,,Sonel,,Sonel
"え？　"シチュー鍋のかき混ぜ棒事件"に
心当たりはないかって？",Sonel,,Sonel,,Sonel
"隊長、そんな珍妙な話が
いったいボクと何の関係があるというんだい？",Sonel,,Sonel,,Sonel
犯人の正体について,Sonel,,Sonel,,Sonel
シチュー鍋のかき混ぜ棒の行方,Sonel,,Sonel,,Sonel
"今はそんなおとぎ話みたいな事件の真相を
追いかけてる場合ではないだろう！",Sonel,,Sonel,,Sonel
"確かにボクは食堂のシチューが大好きさ
何かがんばったご褒美に
必ずシチューを食べることにしている",Sonel,,Sonel,,Sonel
"夜中までかかってようやく
倉庫中ひっくり返して《鍵》を見つけたあの日も
その足でまっすぐ食堂へ向かったね",Sonel,,Sonel,,Sonel
"それで鍋から直接シチューを
失敬しようとして、あやうくローブの袖が
浸かりそうになったからあわてて――",Sonel,,Sonel,,Sonel
"袖の中には大事な《鍵》が入っていたし
万が一鍋の中に――落としたりでも――したら――",Sonel,,Sonel,,Sonel
あ――,Sonel,,Sonel,,Sonel
――,Sonel,,Sonel,,Sonel
――――,Sonel,,Sonel,,Sonel
"鍋だ！　隊長！
シチュー鍋だ！
《鍵》はそこだ！",Sonel,,Sonel,,Sonel
一刻も早く、食堂に向かってくれたまえ！,Sonel,,Sonel,,Sonel
"今はそんなおとぎ話みたいな事件の真相を
追いかけてる場合ではないだろう！",Sonel,,Sonel,,Sonel
"確かにボクは食堂のシチューは大好きさ
何かがんばったご褒美に
必ずシチューを食べることにしている",Sonel,,Sonel,,Sonel
"夜中までかかってようやく
倉庫中ひっくり返して《鍵》を見つけたあの日も
その《鍵》を握り閉めてまっすぐ食堂へ向かったね",Sonel,,Sonel,,Sonel
"シチューを食べようと鍋に手を伸ばしたその時
思いもよらぬモノが目に入ってね",Sonel,,Sonel,,Sonel
「もしかしてこれ、ボクの"相棒"なんじゃ？」,Sonel,,Sonel,,Sonel
"そう思った次の瞬間には、それを抱えて
外に飛び出してたよ！",Sonel,,Sonel,,Sonel
"結局それはボクの"相棒"じゃなかったんだが
あれを手にしたその瞬間――",Sonel,,Sonel,,Sonel
"シチューまみれになるのも忘れて
両の手で――力いっぱい鍋から
引き上げ――て――",Sonel,,Sonel,,Sonel
あ――,Sonel,,Sonel,,Sonel
――,Sonel,,Sonel,,Sonel
――――,Sonel,,Sonel,,Sonel
"鍋だ！　隊長！
シチュー鍋だ！
《鍵》はそこだ！",Sonel,,Sonel,,Sonel
一刻も早く、食堂に向かってくれたまえ！,Sonel,,Sonel,,Sonel
"おや、覚者さんかい
どうしたんだい？そんな慌てて",Yonas,,Yonas,,Yonas
え？　シチュー鍋に大事な《鍵》を落とした？,Yonas,,Yonas,,Yonas
"シチュー鍋なら部屋の真ん中の大きいやつだけど
あいにく今、かき混ぜ棒がなくて
鍋の中のもの探すのは大変だよ",Yonas,,Yonas,,Yonas
"奪還直後で何かと物がなくてね
ちょうど倉庫で大鍋に使えそうな
"大きな棒状のもの"を見つけたんで使ってたのさ",Yonas,,Yonas,,Yonas
"でも、数日前に食堂に現れた侵入者が
なぜかその棒を持って行っちゃったんだよ
ほんと迷惑な話さ！",Yonas,,Yonas,,Yonas
"それに、今そこにあるのは
今朝から仕込み中のシチューだけど
《鍵》なんか入ってなかったと思うよ",Yonas,,Yonas,,Yonas
"２、３日前のものなら
小鍋に移してどこかのテーブルに
置いてたと思うから、そっちを探しなよ",Yonas,,Yonas,,Yonas
"貴重な食べ物なんだから
ダメにしないように探しておくれね",Yonas,,Yonas,,Yonas
"隊長！　どうだった！？
《鍵》は見つかったかい！？",Sonel,,Sonel,,Sonel
――――,Sonel,,Sonel,,Sonel
"これだ！
紛れもなく裏門の《鍵》だ！",Sonel,,Sonel,,Sonel
"さすがだ！　さすがは隊長だ！
これさえ――これさえあれば
最早城外は奪還したも同然！",Sonel,,Sonel,,Sonel
"さぁ！
このアツアツの《鍵》とボクの情熱が冷めないうちに
奪還作戦の最終段階へ進むとしよう！",Sonel,,Sonel,,Sonel
"隊長！　どうだった！？
《鍵》は見つかったかい！？",Sonel,,Sonel,,Sonel
――――,Sonel,,Sonel,,Sonel
なんだいこれは――？,Sonel,,Sonel,,Sonel
"くそっ！　ただのスプーンじゃないか！
誰だ！　鍋にスプーンを落とす
非常識なやつは！",Sonel,,Sonel,,Sonel
"このままではボクが煮込み続けた作戦が
すべて蒸発してしまう！",Sonel,,Sonel,,Sonel
"《鍵》が誰かの胃袋に飲み込まれる前に
一刻も早く探して来てくれ！",Sonel,,Sonel,,Sonel
"隊長！　どうだった！？
《鍵》は見つかったかい！？",Sonel,,Sonel,,Sonel
――――,Sonel,,Sonel,,Sonel
なんだいこれは――？,Sonel,,Sonel,,Sonel
"くそっ！　ただの生煮えのジャガイモじゃないか！
誰だ！シチューにジャガイモを入れる
非常識なやつは！",Sonel,,Sonel,,Sonel
"このままではボクが煮込み続けた作戦が
音を立てずに煮崩れしてしまう！",Sonel,,Sonel,,Sonel
"《鍵》が誰かの胃袋に飲み込まれる前に
一刻も早く探して来てくれ！",Sonel,,Sonel,,Sonel
