old,new,speaker,english,speaker,english,speaker
"よぉ相棒――
早速会いに来てくれたのか
元気だったか？",,Mephis,,Mephis,,Mephis
こっちの方は――まぁ、ぼちぼちだな,,Mephis,,Mephis,,Mephis
"クルト家の運営を取り纏めてた家令と
さらには当主までいなくなっちまったんだ――
なかなかに渾沌とした状態だぜ",,Mephis,,Mephis,,Mephis
"とりあえず、今は<NPC 681>の悪事について
他にも証拠がないか家探ししろって任務が来てる
元レジスタンスってことで
暇そうな<NPC 691>と<NPC 697>も駆り出してな",,Mephis,,Mephis,,Mephis
"――覚者、よかったらあいつらにも
会いに行ってやってくれよ",,Mephis,,Mephis,,Mephis
"それじゃあ――
<STG 473>へ向かうか？",,Mephis,,Mephis,,Mephis
はい,Yes,Mephis,,Mephis,,Mephis
いいえ,No,Mephis,,Mephis,,Mephis
それじゃ、出発するか,,Mephis,,Mephis,,Mephis
"そうか？
まぁ、急ぐようなことじゃないからな
準備が出来たら声をかけてくれ",,Mephis,,Mephis,,Mephis
"おお、そうか！
それじゃあ準備ができたら、声をかけてくれ",,Mephis,,Mephis,,Mephis
"クルト家の運営を取り纏めてた家令と
さらには当主までいなくなっちまったんだ――
なかなかに渾沌とした状態だぜ",,Mephis,,Mephis,,Mephis
"とりあえず、今は<NPC 681>の悪事について
他にも証拠がないか家探ししろって任務が来てる
元レジスタンスってことで
暇そうな<NPC 691>と<NPC 697>も駆り出してな",,Mephis,,Mephis,,Mephis
"――覚者、よかったらあいつらにも
会いに行ってやってくれよ",,Mephis,,Mephis,,Mephis
"今は――
屋敷にはガクシャしかいないみたいだな
バジットの奴、またサボりに行ったのか？",,Mephis,,Mephis,,Mephis
"ガクシャなら２階にいるはずだぜ
お前が会いに来たって知ったら、きっと
喜ぶだろうよ",,Mephis,,Mephis,,Mephis
"おや、覚者クン――
元気そうでよかったよ
遊びに来てくれたのかい？",,Raksha,,Raksha,,Raksha
"そうだ、実はね――
隠し書棚から<NPC 681>の前の当主――
エミル様の日記が見つかったんだ",,Raksha,,Raksha,,Raksha
"それによると生前、自分が運営していた救済施設で
特に可愛がっていた子供を一人、後継者として
養子にとる手配を進めていたらしい",,Raksha,,Raksha,,Raksha
"しかし、残念ながらその子供の名前はわからなかった
その子さえ見つかれば
当主不在の混乱も収まるんだが――",,Raksha,,Raksha,,Raksha
"あっ！　でもこれはメフィスには言わないでくれ
詳しくは分からんが、どうやら彼――
エミル様にずいぶんとご執心だったそうじゃないか
その話を聞いたら、落ち込むかもしれないだろう",,Raksha,,Raksha,,Raksha
"ところで――君は、他の仲間たちにも
会いに行くのかい？",,Raksha,,Raksha,,Raksha
"もしカレンに会ったら、伝えてくれ
大急ぎで、とびきりの酒を見繕っておいてくれ
――とね！
頭を使うと喉が渇くんだ、頼んだよ！",,Raksha,,Raksha,,Raksha
"ところで――君は、他の仲間たちにも
会いに行くのかい？",,Raksha,,Raksha,,Raksha
"もしカレンに会ったら、伝えてほしいんだ
大急ぎで、とびきりの酒を見繕っておいてくれ
――とね！",,Raksha,,Raksha,,Raksha
"久しぶりに “ガクシャ”っぽい仕事をしたから
酷く喉が渇くんだ――
頼んだよ！",,Raksha,,Raksha,,Raksha
"よぉ、覚者さん元気か！
俺は親父共々、侯爵家に世話になっててさ",,Basit,,Basit,,Basit
"<NPC 681>が残したものを漁って、何か他に
悪いことしてないか調べる退屈な生活を送ってんだ
――あ、だからってサボってないぜ
今は自主休憩中なんだっての！",,Basit,,Basit,,Basit
"正直、カネのことを言えば憲兵だった頃の方が
上だけど――
今の方が穏やかな気分だし、こういうのが
地に足が着いた暮らしってことなんだろうな",,Basit,,Basit,,Basit
"そういえば、セムには会ったか？
上の階にいるんだ――せっかくだから
顔だけでも見せて来てやりなよ",,Basit,,Basit,,Basit
"まぁ、覚者さん！
元気にしてた？",,Karen,,Karen,,Karen
"――え？
ガクシャさんから伝言を頼まれたって？",,Karen,,Karen,,Karen
"んもう――
せっかくしばらく断酒できていたっていうのに
覚者さんまで寄越して、仕方のない人ね",,Karen,,Karen,,Karen
"分かったわ、お酒の件は私に任せて
酒場を司るものとして――
なんとかお酒を止めさせてみせるから！",,Karen,,Karen,,Karen
"ところで、最近ガクシャさんだけじゃなくて
<NPC 691>さんまでよくここに来るようになったの
確か侯爵家で働き始めたはずなんだけど――
全く、レジスタンスは仕方のない人ばっかりね！",,Karen,,Karen,,Karen
"ね、ちょうどそこにいるから
良かったら声をかけてきたら？",,Karen,,Karen,,Karen
"最近ガクシャさんだけじゃなくて
<NPC 691>さんまでよくここに来るようになったの
確か侯爵家で働き始めたはずなんだけど――
全く、レジスタンスは仕方のない人ばっかりね！",,Karen,,Karen,,Karen
"ね、ちょうどそこにいるから
良かったら声をかけてきたら？",,Karen,,Karen,,Karen
"そういえば、セムには会ったか？
上の階にいるんだ――せっかくだから、
顔だけでも見せてきてやりなよ",,Basit,,Basit,,Basit
"さーて――
カレンちゃんに言いつけられる前に
仕事に戻るとしようかなっと！",,Basit,,Basit,,Basit
"あれ――覚者さんじゃないですか
どうしたんです？",,Shem,,Shem,,Shem
"あぁ、<NPC 691>さんですか――
ふふ",,Shem,,Shem,,Shem
"あれから、何となくみなさん
酒場の周りに集まることが多くなったんですよ
なんだか、目的が終わっても仲良くできるのって
良いですよね",,Shem,,Shem,,Shem
"あ――覚者さんも、いつでも来てくださいね
編成の仕事だけじゃなくて、おしゃべりにでも！",,Shem,,Shem,,Shem
"なんだかあれから、何となくみなさん
酒場の周りに集まることが多くなったんですよ
なんだか、事件が終わっても仲良くできるのって
良いですよね",,Shem,,Shem,,Shem
"あ――覚者さんも、いつでも来てくださいね
編成の仕事だけじゃなくて、おしゃべりにでも！",,Shem,,Shem,,Shem
お――どうだったんだ？,,Mephis,,Mephis,,Mephis
"はは、カレンやセムにも会ってきたのか
相変わらず元気にやっているみたいで
よかったな",,Mephis,,Mephis,,Mephis
"戦いで忙しいかもしれないが
こうして、たまには仲間に
顔を見せに来てくれよ",,Mephis,,Mephis,,Mephis
――それじゃあ、またな,,Mephis,,Mephis,,Mephis
