old,speaker
"第二防衛区画も無事奪還できたね！
ボクの想定よりかは
少々派手な奪還劇にはなったけど――",Sonel
"こうして隊長もピンピンしてるし
結果オーライさ！",Sonel
"――おいおい
そんな目でボクを見つめないでおくれよ！",Sonel
"あれは、あの大砲くんが
ちょっとやんちゃだっただけさ！",Sonel
"さて――
いよいよ最終防衛区画へ乗り込む
奪還作戦のクライマックス目前なわけだが",Sonel
その前に、隊長に話しておきたいことがあるんだ――,Sonel
"実に、大事な話さ
もちろん聞いてくれるよね？",Sonel
"ボクと隊長の仲だ
必ずそう言ってくれると信じてたよ！",Sonel
"実は、以前第一防衛区画で
隊長に見つけてもらった杖なんだけど――",Sonel
"あれ、やっぱりボクの“相棒”じゃない
気がするんだ！",Sonel
"よく見たら結構奇抜なデザインだし
色合いも一般ウケしないし――
「あれ、こんなだったかな？」って",Sonel
"確かにあの時は、あまりの嬉しさに
「あ、これボクの“相棒”だ！」
って思ったんだけどね",Sonel
"今朝、ようやく騙されていたことに気づいて
その何処にもぶつけようのない怒りが
“彼”を薪に変えてしまったというわけさ",Sonel
"つまり、今度こそ本当の“相棒”を
探しに行きたいから
準備ができたら遠慮なく声をかけてくれたまえ！",Sonel
"お！　準備ができたみたいだね！
さすがは隊長だ",Sonel
"本当の“相棒”を見かけたポイントは
ある程度覚えているのでね！
また一緒に探して欲しいんだ",Sonel
"さ、さ！
今回もボクの記憶が微かなうちに
奪還した第二防衛区画へ行くとしよう！",Sonel
"ううむ――
来てみたはいいが
実際見回すとどこもかしこも怪しく見えるな",Sonel
"ここへ来る途中の井戸の中でね
がんばって思い出そうとしたんだ",Sonel
"でもさ、人ってがんばり過ぎると
空回りする生き物だろ？",Sonel
"その結果、努力が実って
心当たりがいくつか増えてしまったと言うわけさ！",Sonel
"え？　前もまったく同じこと言ってたって？
それじゃあ話は早いね！",Sonel
"「狭い隙間」
「ちょっと高いところ」
「ガチャ！　ゴゴゴゴゴ――」",Sonel
"今のボクをかろうじて支えているのは
この３つのイメージだけだね！",Sonel
"この《大演習場》は広くてボクだけで
探すのは無理みたいだ
もう行けるとこ全部探しもらうしかないね！",Sonel
扉を使えば、自由に隣へ移動できるはずだ,Sonel
"どれも見た目では分からない所にあったからね
とにかく怪しい場所には
“<COL ff2600>できる限り近づいて探す</COL>”といい",Sonel
"ボクの記憶に頼りたくなったら
また話しかけてくれるといい",Sonel
"うーん――
今朝食べたごはん、なんだったかな――",Sonel
"お、なんだキミか
何か見つかったかな？",Sonel
"その顔を見ると、行き詰ってるようだね
どの記憶について聞きたいかな？",Sonel
「狭い隙間」,Sonel
「ちょっと高いところ」,Sonel
「ガチャ！　ゴゴゴゴゴ――」,Sonel
探し方のコツ,Sonel
"「狭い隙間」か――
あれは確か、無数の敵の目をかいくぐりながら
潜入していた時だったかな",Sonel
"身を隠せる場所が少なくてね
色んな方向性を探っていた真っ最中さ",Sonel
"「あ、この隙間はアリなんじゃないかな？」
と思って、とりあえず挟まってみたんだ",Sonel
"その時に、近くにそれらしいモノが見えた気が
するんだけど――",Sonel
"あまりのフィット感に感動すら覚えてしまい
その反動で杖のことを忘れてしまったのさ！",Sonel
"参考になったかな？
また、分からなくなったら
ボクに話しかけてくれるといい",Sonel
"「ちょっと高いところ」か――
あれは確か、この第二防衛区画の最後の敵に
とどめを刺そうという時だったかな",Sonel
"「締めにふさわしい魔法はどれかな？」
というのを考えていて空を見上げたのさ",Sonel
"その時だったかな、ちょっと高い場所に
なんかそれっぽいモノが見えた気がしたんだ",Sonel
"手が届きそうにはなかったからね
そこへ行くためにはどうするべきか――
を考えようとした瞬間",Sonel
"気が抜けてしまって魔法は不発――
結局おいしいところは
隊長に持ってかれてしまったよ！",Sonel
"参考になったかな？
また、分からなくなったら
ボクに話しかけてくれるといい",Sonel
"「ガチャ！　ゴゴゴゴゴ――」か――
それについてなんだが――",Sonel
実はハッキリ覚えてないのだよ！,Sonel
「ガチャ！　ゴゴゴゴゴ――」,Sonel
"頼りはこの音だけさ！
確か、<COL ff2600>合計で３回</COL>聞いてて
そのうちの１回の時に見えた気がするんだ",Sonel
"あとは、その場所で
隊長が何か楽しげなことをするのを、ワクワクして
眺めていた思い出くらいしかなくてね！",Sonel
"参考になったかな？
また、分からなくなったら
ボクに話しかけてくれるといい",Sonel
"ボクが見た記憶のあるものは
どれも見た目には分からない場所にあった",Sonel
"パッと見で何もなさそうな場所でも
“<COL ff2600>できる限り近づいて探す</COL>”方がいいだろう",Sonel
"参考になったかな？
また、分からなくなったら
ボクに話しかけてくれるといい",Sonel
うおおおおおおおおおおお！！！！！,Sonel
"何も、何も言わなくてもいい！
その手に持っているものさえあれば
世界に杖なんかいらない！",Sonel
"それだ！　ボクの“相棒”！
それこそが！
今度こそ本当にボクのお気に入りの大杖さ！",Sonel
"さ、さ、さ！
渡してくれたまえ！",Sonel
"おお、おお
これこれ！この感じだ！",Sonel
"この手になじむ重量感、違和感のないフォルム
主そっくりな存在感――まさに",Sonel
これがボクの“相棒”さ！,Sonel
"よし！　よし！
杖の奪還任務は完了だ！
さっそく城へ戻ろう！",Sonel
１９８３――,Sonel
１９８３――１９８４――,Sonel
１９８３――１９８４――１９８５,Sonel
"おっといけない！
また、空にあるだろう星の数を
数えてしまっていた！",Sonel
"人の想像力というものは
なんと恐ろしいのだろうか",Sonel
"あ、キミか
どうだい“相棒”捜索のほうは",Sonel
"お！　その顔は何か見つけたやつの顔だね！
どれどれ、早く見せてくれたまえ！",Sonel
――――,Sonel
"「太い枝」だね！これは！
これは「太い枝」！",Sonel
"「狭い隙間」で見つけたって？
それじゃあ単に全体的に見間違えたのだろう",Sonel
"あっはっは！
ボクとしたことが！　ケッサクだね！",Sonel
"すまないが、「狭い隙間」は
キレイさっぱり忘れてくれたまえ！
別のポイントの捜索を頼んだよ！",Sonel
３――,Sonel
３――２――,Sonel
３――２――１,Sonel
"あ、キミか
たまには数を減らしてみたんだが
どうかな？",Sonel
何か変な期待をさせてしまってたらすまない,Sonel
で、どうだい“相棒”捜索のほうは,Sonel
"お！　その顔は何か見つけたやつの顔だね！
どれどれ、早く見せてくれたまえ！",Sonel
――――,Sonel
"「つけもの石」だね！　これは！
これは「つけもの石」！",Sonel
"「ガチャ！　ゴゴゴゴゴ――」で見つけたって？
それじゃあ単に空気感で見間違えたのだろう",Sonel
"あっはっは！
ボクとしたことが！　ケッサクだね！",Sonel
"すまないが、「ガチャ！　ゴゴゴゴゴ――」は
キレイさっぱり忘れてくれたまえ！
別のポイントの捜索を頼んだよ！",Sonel
――,Sonel
――――,Sonel
――――――,Sonel
"隊長――
ちょっと大事な話があるんだ",Sonel
"さっき帰りに井戸の中を通っている最中に
思い出したことがあってね",Sonel
"「あ、そう言えばボク
　自分で“相棒”隠したんだった」
と――",Sonel
"この城が奪われた際
敵の目を欺くために自分から地下牢に
入ってたんだけどさ",Sonel
"ほら、武器を持ったまま捕まってるのって
オークが見たって絶対におかしいだろ？",Sonel
"だから、とっさに牢の中の目立たない所に
隠したんだよね！",Sonel
"で――
実際ちゃんとそこにあったというわけさ！",Sonel
"いやぁ、さすがのボクも
“なくしたものは自分で隠した”
というのは盲点だった！",Sonel
"てっきり、敵に奪われたものだとばっかり
思って疑わなかったのさ！",Sonel
"思い込みというのは
時に恐ろしい敵に成長するものだね！
あっはっはっは！",Sonel
"――さて、ついに“相棒”もこの手に戻ったし
裏門の《鍵》もあるし
“とっておきの作戦”――決行の時だ！",Sonel
"あ、さっき見つけてくれた棒切れだけど
さっさと薪にすることをおすすめするよ！",Sonel
