old,new,speaker,english,speaker,english,speaker
"やぁ、キミか！
この間の潜入任務のときは助かったよ",,Sonel,,Sonel,,Sonel
"敵戦力の現状も目の当たりにしたし
《第一防衛区画》の攻略を進めないとね",,Sonel,,Sonel,,Sonel
"もちろん！
今回もキミの席は空けてあるから
心配は無用さ！",,Sonel,,Sonel,,Sonel
受注キャンセル時会話（仮）,,Sonel,,Sonel,,Sonel
"ようし、まだまだやることはたくさんあるが
まずは奴らの戦力を削ることが先決だ",,Sonel,,Sonel,,Sonel
"潜入の準備はできている
戦いの方は――まだちょっと遠慮したいけどね",,Sonel,,Sonel,,Sonel
さて、今回はどうするかな――,,Sonel,,Sonel,,Sonel
《兵舎》を攻略する,"Capture ""Barracks""",Sonel,,Sonel,,Sonel
《集会場》を攻略する,"Capture ""Meeting Spot""",Sonel,,Sonel,,Sonel
準備に戻る,Return to preparation,Sonel,,Sonel,,Sonel
"《兵舎》は敵の寝床のようだね
兵隊にとって"睡眠"は重要だ",,Sonel,,Sonel,,Sonel
"どんなに屈強なオークと言えど――
快適な睡眠なくして
最大限の力は発揮できないだろう",,Sonel,,Sonel,,Sonel
"作戦のポイントはそこにある
さぁ、行こう！",,Sonel,,Sonel,,Sonel
"《集会場》は敵が多く集まる場所だ
危険ではあるが、戦力を一気に削るチャンスが
どこかにあるはずだ",,Sonel,,Sonel,,Sonel
"潜入し、その糸口を探す
さぁ、行こう！",,Sonel,,Sonel,,Sonel
"この潜入任務では、ボクとキミの二人だけだ
他に頼れる者はいない
しっかり準備してきてくれよ",,Sonel,,Sonel,,Sonel
"よし――敵の気配はない
今のうちに、すばやく行動に移ろう",,Sonel,,Sonel,,Sonel
"ここにある３つのテントそれぞれに
ボクが"ちょっとした細工"を施す",,Sonel,,Sonel,,Sonel
"平たく言えば――
"寝心地を悪くしてオークくんの睡眠を妨害する"
という、とてもシンプルな作戦さ",,Sonel,,Sonel,,Sonel
"兵士にとって、睡眠不足は大敵だからね
地味だけど、確実に戦力を削れること間違いなし！
というわけさ",,Sonel,,Sonel,,Sonel
"テントの細工はボクが担当する
昨晩「どうすれば寝心地が悪くなるか」を考えるのが
あまりに楽しくて、ちょっと寝不足気味だけどね",,Sonel,,Sonel,,Sonel
"そうそう、重要なことを言い忘れていた
ボクは１つのことに集中してると
周りのことはまったく見えなくてね",,Sonel,,Sonel,,Sonel
"キミは、敵が来たらボクの所へ来て知らせて欲しい
近づいて話しかけてくれれば、テントの中に隠れるよ",,Sonel,,Sonel,,Sonel
"隠れている間は当然細工はできない
安全を確認したら、またボクにタッチしてくれ
テントの外に出て、細工を再開するのでね",,Sonel,,Sonel,,Sonel
"それと、もう一つ頼みたいことがあるんだ
向こうで話そう",,Sonel,,Sonel,,Sonel
"テントの細工はボクに任せてくれ
《生乾きの布》を探すのは、キミに任せるとしよう",,Sonel,,Sonel,,Sonel
"よしよし、いいかい？
昨晩いろいろと考えていたのだが――",,Sonel,,Sonel,,Sonel
"《生乾きの布》――
こいつに可能性を感じるんだよね
ボクの中で"使い方"のイメージはすでにある",,Sonel,,Sonel,,Sonel
"とにかく、近くにある"布"を探して
使えそうなものがあれば持って来て欲しい",,Sonel,,Sonel,,Sonel
"オークくんが巡回してることもあるだろうから
見つからないように気をつけてくれ",,Sonel,,Sonel,,Sonel
"もちろん、ボクのことも気にかけてくれよ！
どちらかが見つかっても、戦闘は避けられないからね",,Sonel,,Sonel,,Sonel
それじゃあ、作戦開始だ！,,Sonel,,Sonel,,Sonel
"よし、小さいテントはこんなもんかな！
キミが持って来た"アレ"がいい仕事をしたよ
まぁ、詳しくは聞かない方がいいだろうね！",,Sonel,,Sonel,,Sonel
さて、今のところ敵の姿はないようだが――,,Sonel,,Sonel,,Sonel
《兵舎》に残って作戦を続ける,"Remain in ""Barracks"" and continue the tactics",Sonel,,Sonel,,Sonel
《第一の門》を攻略する,"Capture ""First Gate""",Sonel,,Sonel,,Sonel
撤退して成果を確認する,Withdraw and review results,Sonel,,Sonel,,Sonel
"そうだね、もう少しだけ粘ろう！
次は――あの中くらいのテントにしよう",,Sonel,,Sonel,,Sonel
"要領は先ほどと同じだ
どれどれ、まずは"寝床チェック"を――",,Sonel,,Sonel,,Sonel
"ちょうどボクも、同じことを考えていたところさ！
これまでの作戦の成果で十分弱体化されていれば
少数の戦力でも勝てる見込みはある",,Sonel,,Sonel,,Sonel
さ、気を引き締めて行こう！,,Sonel,,Sonel,,Sonel
"そうだね、確かに無理は禁物だ
この作戦は少しずつの積み重ねが重要だからね
今回はこれで引き上げるとしよう",,Sonel,,Sonel,,Sonel
"テントの細工はボクに任せてくれ
今必要なのは《オオワラカミツキ》だ
"わら"の中を探すといい",,Sonel,,Sonel,,Sonel
"よしよし、いいかい？
これはさっき"わら"に突っ込んでいて
思いついたんだけど――",,Sonel,,Sonel,,Sonel
"《オオワラカミツキ》――
こいつが効果的だと思うんだよね
"使い方"のイメージがどんどん膨らんでいる",,Sonel,,Sonel,,Sonel
"え！知らないのかい？！
《オオワラカミツキ》を！
ここアッカーシェランじゃおなじみのヤツさ",,Sonel,,Sonel,,Sonel
"そうだな――
そいつは"わら"の中でよく見かけるが
良く似た種がいるから注意が必要だ",,Sonel,,Sonel,,Sonel
《ワラカミツキモドキ》,,Sonel,,Sonel,,Sonel
"《ワラカミツキモドキ》
《ニセワラカミツキ》",,Sonel,,Sonel,,Sonel
"《ワラカミツキモドキ》
《ニセワラカミツキ》
《ワラカミツキダマシ》",,Sonel,,Sonel,,Sonel
"こいつらではダメだ
なんていうか――
その時の"インパクト"が今ひとつでね！",,Sonel,,Sonel,,Sonel
"必要なのは本家本元の
《オオワラカミツキ》さ！
大丈夫、実際見れば一発でわかるよ",,Sonel,,Sonel,,Sonel
"もちろん、ボクのことも気にかけてくれよ！
どちらかが見つかっても、戦闘は避けられないからね",,Sonel,,Sonel,,Sonel
それじゃあ、作戦開始だ！,,Sonel,,Sonel,,Sonel
"よし、中くらいのテントはこんなもんかな！
キミが持って来た"アレ"がね――
いやいや、この話は後にしよう",,Sonel,,Sonel,,Sonel
さて、今のところ敵の姿はないようだが――,,Sonel,,Sonel,,Sonel
《兵舎》に残って作戦を続ける,"Remain in ""Barracks"" and continue the tactics",Sonel,,Sonel,,Sonel
《第一の門》を攻略する,"Capture ""First Gate""",Sonel,,Sonel,,Sonel
撤退して成果を確認する,Withdraw and review results,Sonel,,Sonel,,Sonel
"そうだね、もう少しだけ粘ろう！
最後は――いよいよあの一番大きなテントだ",,Sonel,,Sonel,,Sonel
"要領は先ほどと同じだ
どれどれ、まずは"寝床チェック"を――",,Sonel,,Sonel,,Sonel
"ちょうどボクも、同じことを考えていたところさ！
これまでの作戦の成果で十分弱体化されていれば
少数の戦力でも勝てる見込みはある",,Sonel,,Sonel,,Sonel
さ、気を引き締めて行こう！,,Sonel,,Sonel,,Sonel
"そうだね、確かに無理は禁物だ
この作戦は少しずつの積み重ねが重要だからね
今回はこれで引き上げるとしよう",,Sonel,,Sonel,,Sonel
"テントの細工はもちろんボクがやる
《熟成爆弾カボチャ》、こいつを探して来てくれ",,Sonel,,Sonel,,Sonel
"よしよし、いいかい？
これは試してみる価値はあると思うんだが――",,Sonel,,Sonel,,Sonel
"《熟成爆弾カボチャ》――
こいつの存在は無視できないね！
たまに自分の想像力が恐ろしくなるくらいさ",,Sonel,,Sonel,,Sonel
"え？　さすがにこんなとこに
そんなものあるわけないって？",,Sonel,,Sonel,,Sonel
"実はね――
作戦の一環として何日か前に
いくつか展望城から投げ込んでおいたのさ！",,Sonel,,Sonel,,Sonel
"ボクが扉越しにこの耳で集めた情報から
やつらは"カボチャが嫌い"と踏んでいてね
この日のために準備をしておいた",,Sonel,,Sonel,,Sonel
"おそらくだけど――
この辺りに落ちたはずだからさ
探して来ておくれよ！",,Sonel,,Sonel,,Sonel
"いつも通り、オークの巡回には注意してくれ
それじゃあ、作戦開始だ！",,Sonel,,Sonel,,Sonel
"よしよし！　万事、うまくいったぞ！
すべてのテントへの細工が完了さ！
これでまた、奴らの戦力は弱体化される",,Sonel,,Sonel,,Sonel
"そろそろ城へ帰還する頃合いだが
さて、どうしたものか――",,Sonel,,Sonel,,Sonel
帰還して成果を確認する,Return and review results,Sonel,,Sonel,,Sonel
《第一の門》を攻略する,"Capture ""First Gate""",Sonel,,Sonel,,Sonel
"今回は十分な成果を出せたし
この作戦は少しずつの積み重ねが重要だからね
さぁ、城へ戻ろう！",,Sonel,,Sonel,,Sonel
"ちょうどボクも、同じことを考えていたところさ！
これまでの作戦の成果で十分弱体化されていれば
少数の戦力でも勝てる見込みはある",,Sonel,,Sonel,,Sonel
さ、気を引き締めて行こう！,,Sonel,,Sonel,,Sonel
"今回の《兵舎》の攻略はこれで完了だ
少しずつではあるが、敵の戦力も弱体化してきている
この調子でよろしく頼むよ！",,Sonel,,Sonel,,Sonel
"《集会所》は、この《第一防衛区画》の中で
最も防備が手厚い",,Sonel,,Sonel,,Sonel
"だからこそ、ここを攻略することは
大きな意味がある",,Sonel,,Sonel,,Sonel
"もちろん正面突破は不可能だから
潜入しながら何か作戦を立てるしかないな",,Sonel,,Sonel,,Sonel
"櫓に見張りのオークもいるし
ここは固まって動くと却って目立ってしまう",,Sonel,,Sonel,,Sonel
"キミは自分のタイミングで潜入してくれ
ボクは、ボクなりの方法で潜入を試みる",,Sonel,,Sonel,,Sonel
"この奥に同志らしき姿があるが、見えるかい？
彼の身形、解放軍の兵士だ
なんとか接触できればいいのだが――",,Sonel,,Sonel,,Sonel
"キミは自分のタイミングで潜入してくれ
ボクは、ボクなりの方法で潜入を試みる",,Sonel,,Sonel,,Sonel
"この奥に同志らしき姿があるが、見えるかい？
彼の身形、解放軍の兵士だ
なんとか接触できればいいのだが――",,Sonel,,Sonel,,Sonel
早く探ってきてくれよ（仮）,,Sonel,,Sonel,,Sonel
"ここには誰もいないよ！
他の"わら"をあたってくれたまえ！",,Sonel,,Sonel,,Sonel
"――え、なんだキミか？
脅かさないでくれよ",,Sonel,,Sonel,,Sonel
"見ての通り、身を隠してるわけだが
"存在感"までは隠しきれなかったようだね",,Sonel,,Sonel,,Sonel
"なんだって、火薬庫を見つけた？
ふむふむなるほど――",,Sonel,,Sonel,,Sonel
"そいつは確かに使えそうだが
見張りがいて近づけない――か",,Sonel,,Sonel,,Sonel
"その見張りを何とかする方法があればいいが
とにかく今は、もう少し辺りを調べてみよう",,Sonel,,Sonel,,Sonel
"あ、あんたは――
こんなオークだらけの場所にいったいどうやって",,Elmer,,Elmer,,Elmer
"なんだって！
ソネル様とここを奪還しに来た？！",,Elmer,,Elmer,,Elmer
"そうだったのか――
俺はエルマー、解放軍の兵士だ
展望城脱出の際に捕まってしまったんだ",,Elmer,,Elmer,,Elmer
"情けない話だが――
今は、敵の武具の整備をさせられている
他にも捕虜がいて、俺だけここに連れて来られた",,Elmer,,Elmer,,Elmer
"人質を取られて、こうする他なかったんだ
俺がいなくなったと知られれば
今度は彼らの命が危険に去らされてしまう",,Elmer,,Elmer,,Elmer
"俺だけ逃げるわけにはいかない
しかし、今の俺にできることがあるなら
なんでも協力するんだが――",,Elmer,,Elmer,,Elmer
"ああ、あんたか
気持ちはありがたいが――",,Elmer,,Elmer,,Elmer
"俺だけ逃げるわけにはいかない
しかし、今の俺にできることがあるなら
なんでも協力するんだが――",,Elmer,,Elmer,,Elmer
"あんたは――
助けに来てくれたのはありがたいが
俺はここを動くことはできないんだ",,Elmer,,Elmer,,Elmer
"解放軍の兵士として
敵の武具を整備させられるのは屈辱だが
人質を取られていては逆らえない",,Elmer,,Elmer,,Elmer
こんな俺にでも、何かできるといいんだが――,,Elmer,,Elmer,,Elmer
"何？　火薬庫を――なるほど
それはなかなか名案
さすがはソネル様だ",,Elmer,,Elmer,,Elmer
"火薬庫の見張りをしてる奴は
俺に武具整備を押し付けた張本人でな
どうも下っ端らしい",,Elmer,,Elmer,,Elmer
"雑用ばかりさせられてるみたいだ――
まぁ、これもその１つなんだろうが",,Elmer,,Elmer,,Elmer
"そこのテントの中にある張り紙で
"仕事"が伝達されているらしい",,Elmer,,Elmer,,Elmer
"そいつを換えてやれば
奴を火薬庫の前から引き離すのは容易さ
確か、ちょうどいいのがあったはず――",,Elmer,,Elmer,,Elmer
"――ほら、こいつを持って行ってくれ
奴が櫓上の見張りをしたときの張り紙さ
いつか使えねぇかと、失敬しておいたんだ",,Elmer,,Elmer,,Elmer
"さ、こんなとこに長居は無用だ
あんたはそれを持ってテントへ行ってくれ
――頼んだぜ",,Elmer,,Elmer,,Elmer
"さ、こんなとこに長居は無用だ
あんたはその張り紙を持ってテントへ行ってくれ
――頼んだぜ",,Elmer,,Elmer,,Elmer
"キミならここを見つけてくれると思ってたよ
一部始終は把握している
ボクは耳がいいからね！",,Sonel,,Sonel,,Sonel
"やっかいな見張りくんの新しいお仕事は
"櫓の上の見張り"か――
なるほど、こいつはちょうどいい",,Sonel,,Sonel,,Sonel
その櫓を今から吹っ飛ばすのが作戦だからね！,,Sonel,,Sonel,,Sonel
"さ、見張りくんがいなくなったのを確認したら
火薬庫へ向かってくれ",,Sonel,,Sonel,,Sonel
"これをこうして――いや
せっかくだし派手にいこう――
よしよし、これで完了だ",,Sonel,,Sonel,,Sonel
"櫓を吹っ飛ばすには少々火力不足だったんでね
ちょっと細工をしておいたよ
さ、爆発するぞ、安全な場所まで離れよう",,Sonel,,Sonel,,Sonel
はっはっは！,,Sonel,,Sonel,,Sonel
いやぁ、実に爽快！,,Sonel,,Sonel,,Sonel
"ボクの本気の魔法よりかは
少々派手さと気品に欠けるが――
櫓ごと奴らを吹っ飛ばすにはこれで十分だ",,Sonel,,Sonel,,Sonel
"キミの協力のおかげで
奴らに大打撃を与えられたよ
作戦は大成功さ！",,Sonel,,Sonel,,Sonel
"こいつはたまげたな！
さすがはソネル様だ",,Elmer,,Elmer,,Elmer
"どうやら、あの下っ端もろとも
ふっ飛ばしてくれたようだな
感謝するよ",,Elmer,,Elmer,,Elmer
"この混乱に乗じて、俺も脱出できそうだ
戻ってソネル様に話したいこともあるしな",,Elmer,,Elmer,,Elmer
"あんたにも礼を言わせてもらうよ
とにかくありがとう！",,Elmer,,Elmer,,Elmer
これで制圧完了だ。次に行こうか（仮）,,Sonel,,Sonel,,Sonel
"実に見事な潜入任務だった！
あの広場の敵を一掃したことで
結構な損害を与えたはずさ",,Sonel,,Sonel,,Sonel
"成果は着実に出ている
焦らず、この調子で
《第一防衛区画》を攻略していこう！",,Sonel,,Sonel,,Sonel
"よしよし！　万事、うまくいったぞ！
これでまた、奴らの戦力は確実に弱体化される",,Sonel,,Sonel,,Sonel
"《第一の門》の状況は気になるが――
さて、どうするかな",,Sonel,,Sonel,,Sonel
《第一の門》を攻略する,"Capture ""First Gate""",Sonel,,Sonel,,Sonel
帰還して成果を確認する,Return and review results,Sonel,,Sonel,,Sonel
"そうだね、今回の任務の成果はこれで十分だ
同志を一人救出できたし、一旦城へ戻ろう！",,Sonel,,Sonel,,Sonel
"この勢いをムダにしたくないからね！
オークと鉄は熱いうちに打てだ
よし、行くぞ！",,Sonel,,Sonel,,Sonel
"見てくれ、敵は明らかに弱っている
兵の数も、防衛設備もすでにガタガタだ",,Sonel,,Sonel,,Sonel
"ここまでくれば、十分勝機はある
さ、一気に行くぞ！",,Sonel,,Sonel,,Sonel
"見てくれ、敵陣の様子が少し変わっている
ボクらの潜入作戦は
確実に奴らの戦力を弱体化させているようだ",,Sonel,,Sonel,,Sonel
"今なら、なんとかなるかもしれない
だが、敵もそう簡単には
ここを明け渡してはくれないだろう",,Sonel,,Sonel,,Sonel
"ボクが危険と判断したら撤退する
制圧に失敗しても、今回与えた損害は
成果として残せるから、全力で挑もう！",,Sonel,,Sonel,,Sonel
"敵の戦力はまだまだ健在か――
こいつは厳しい戦いになる",,Sonel,,Sonel,,Sonel
"ボクが危険と判断したら撤退する
制圧に失敗しても、今回与えた損害は
成果として残せるから、全力で挑もう！",,Sonel,,Sonel,,Sonel
よし！　《第一の門》は制圧したぞ！,,Sonel,,Sonel,,Sonel
"かなり厳しい戦いだったが
キミの目を見張る活躍、この目で見させてもらったよ",,Sonel,,Sonel,,Sonel
"聞いていた以上の実力だ
今のボクの魔法だけでは
この数の敵は相手にできなかった――",,Sonel,,Sonel,,Sonel
"ありがとう！
さ、一旦城に戻ろう
兵にここの防衛を任せる準備も必要だ",,Sonel,,Sonel,,Sonel
"ありがとう！
《第一防衛区画》の奪還作戦も軌道に乗って来た
これもキミのおかげさ",,Sonel,,Sonel,,Sonel
"ボクは次の作戦の準備をしておこう
また、力を貸してくれないかな？
よろしく頼んだよ！",,Sonel,,Sonel,,Sonel
これをこうして――うんうん、いいね,,Sonel,,Sonel,,Sonel
よし、あともう少しだ,,Sonel,,Sonel,,Sonel
"お！
そいつは《生乾きの布》じゃないか！",,Sonel,,Sonel,,Sonel
"さっそくそいつを渡してくれ！
――キミ、よくこれを平気な顔して持てるね！",,Sonel,,Sonel,,Sonel
"よしよし、これをこうして――
ふふふ――やっぱりボクは天才だね！",,Sonel,,Sonel,,Sonel
"実にすばらしい仕上がり――
１つめのテントの細工は完了だ！",,Sonel,,Sonel,,Sonel
"お！
そいつは《オオワラカミツキ》じゃないか！",,Sonel,,Sonel,,Sonel
"さっそくそいつを渡してくれ！
――ちょっとちょっと！
その持ち方で渡されたら
まずボクが危ないじゃないか！",,Sonel,,Sonel,,Sonel
"よしよし、こいつをここに――
おっと、あぶないあぶない！
ふぅ――このスリルがたまらないね",,Sonel,,Sonel,,Sonel
"まさに命がけの芸術――
２つめのテントの細工は完了だ！",,Sonel,,Sonel,,Sonel
"お！
そいつは《熟成爆弾カボチャ》じゃないか！
やっぱりこの辺にあったね",,Sonel,,Sonel,,Sonel
"さっそくそいつを渡してくれ！
この辺のカボチャは頑丈な皮が特徴でね
限界まで熟成させると爆弾のようになるのさ",,Sonel,,Sonel,,Sonel
"ただ置くだけじゃつまらないからね
さらに工夫してこう――
キミも子供の頃、よくこうやって遊んだだろ？",,Sonel,,Sonel,,Sonel
"まさに伝統の秘密兵器――
最後のテントの細工は完了だ！",,Sonel,,Sonel,,Sonel
"お、キミか
何か使えそうな物は見つかったかい？",,Sonel,,Sonel,,Sonel
"整備中の大砲か――悪くはないが
ここで修理するわけにもいかないだろう",,Sonel,,Sonel,,Sonel
え？　そんなところで何をしてるかって？,,Sonel,,Sonel,,Sonel
"見ての通り"ボクなりの潜入方法"というやつさ
キミもこれくらいの気持ちでやりたまえよ！",,Sonel,,Sonel,,Sonel
"なんだキミか
ボクはね、今隠れるので忙しいんだ",,Sonel,,Sonel,,Sonel
"そこにある攻城槌なら
ボクら二人で動かすのは不可能だ",,Sonel,,Sonel,,Sonel
"そもそも、それは頑丈な門などを
地味にコツコツ破壊するための兵器だしね",,Sonel,,Sonel,,Sonel
この状況で有効に使うのは難しいよ,,Sonel,,Sonel,,Sonel
"ふぅ――
見張りはなんとかなったが
少々騒ぎを起こし過ぎてしまったな",,Sonel,,Sonel,,Sonel
"なぁに、焦ることはないさ
日々少しずつ損害を与えれば
かならず敵は弱体化する",,Sonel,,Sonel,,Sonel
"今日は、ここで切り上げるとしよう
さ、展望城に帰ろうじゃないか",,Sonel,,Sonel,,Sonel
"くっ―――
まだ攻略出来ないみたいだね―――
ここはいったん出直して、準備を整えよう",,Sonel,,Sonel,,Sonel
"潜入の準備はできている
戦いの方は――まだちょっと遠慮したいけどね",,Sonel,,Sonel,,Sonel
さて、今回はどうするかな――,,Sonel,,Sonel,,Sonel
《兵舎》を攻略する,"Capture ""Barracks""",Sonel,,Sonel,,Sonel
《集会所》を攻略する,"Capture ""集会所""",Sonel,,Sonel,,Sonel
準備に戻る,Return to preparation,Sonel,,Sonel,,Sonel
"潜入の準備はできている
戦いの方は――まだちょっと遠慮したいけどね",,Sonel,,Sonel,,Sonel
さて、今回はどうするかな――,,Sonel,,Sonel,,Sonel
《兵舎》を攻略する,"Capture ""Barracks""",Sonel,,Sonel,,Sonel
《集会所》を攻略する,"Capture ""集会所""",Sonel,,Sonel,,Sonel
準備に戻る,Return to preparation,Sonel,,Sonel,,Sonel
"《兵舎》での作戦はもう十分だろう
これ以上やると、せっかく奪還しても
あの辺に近づけなくなるからね！",,Sonel,,Sonel,,Sonel
次の目標はいよいよ《集会場》さ,,Sonel,,Sonel,,Sonel
"《集会場》のオークくん達は
櫓と一緒にふっ飛ばしたじゃないか",,Sonel,,Sonel,,Sonel
次の目標は《兵舎》の攻略さ,,Sonel,,Sonel,,Sonel
え、見つかった！？,,Sonel,,Sonel,,Sonel
"ふぅ――
見張りはなんとかなったが
テントの細工が完了する前に見つかってしまったか",,Sonel,,Sonel,,Sonel
"騒ぎを聞いて増援が駆けつけてくるだろうから
このまま作戦を続行するのは危険だ",,Sonel,,Sonel,,Sonel
一度、展望城に戻って仕切り直すとしよう,,Sonel,,Sonel,,Sonel
