old,speaker,english,speaker,english,speaker
ひとつ、頼まれてくれないだろうか,Metrophanes,,Metrophanes,,Metrophanes
"今や崩れた元居住区の外れに
蒼き竜が飛来したようだ",Metrophanes,,Metrophanes,,Metrophanes
"このメルゴダには未だ、かつて白竜により遺された
竜力の残滓が多く漂っている",Metrophanes,,Metrophanes,,Metrophanes
あの竜が力を付ける前に対処を頼みたいのだ,Metrophanes,,Metrophanes,,Metrophanes
"元居住区の外れに飛来した蒼き竜の対処、
すまないがよろしく頼む",Metrophanes,,Metrophanes,,Metrophanes
元居住区の竜は討たれたか、ありがとう,Metrophanes,,Metrophanes,,Metrophanes
"これも、そして今レスタニアに起こる災いの多くも
かつての錬金術の過ちにより引き起こされたもの――
本当にすまなく思う",Metrophanes,,Metrophanes,,Metrophanes
