old,speaker,english,speaker,english,speaker
"最近不思議な感情に駆られることがある
わたしにとって礼をすべき人は誰だろう？　と
まあまあ――突然で驚いたかもしれないが",Theodor,,Theodor,,Theodor
"君にもいるんじゃないか？
世話になったが、忘れている人が――
そういう人にこそ、お礼をしないとね",Theodor,,Theodor,,Theodor
"なぜこんな事を考えるのか――
思うに、君と出会ってから
こういった人情だとか絆だとか、おかしな事を
考える時間が増えてしまったようだ",Theodor,,Theodor,,Theodor
"つまり、君のせい――と考えられる
ふふ、冗談だよ",Theodor,,Theodor,,Theodor
"なんだ？　俺に用事？
訓練のことじゃないのか？",Renton,,Renton,,Renton
"俺に贈り物かぁ――なんだか照れちゃうな
いや、なんというか、ありがとな",Renton,,Renton,,Renton
"初めてここに来た日を思うと
お前も随分と成長したよなぁ――
近くで見ていた者として、こう、胸に
グッとくるものがあるよ",Renton,,Renton,,Renton
"これからもここで待ってるからな
いつでも来いよ",Renton,,Renton,,Renton
