old,speaker,english,speaker,english,speaker
"噂で耳にしたんですが
今、禁域の方の様子がおかしいそうなんです
でも、何が起きてるかまでは分からないんです",Isabel,,Isabel,,Isabel
"一体どうしたんでしょうね？
《標の祠》に行けば
何かわかるかもしれませんが――",Isabel,,Isabel,,Isabel
"何か大変なことでもあったんでしょうか？
心配ですね",Isabel,,Isabel,,Isabel
"これは覚者様
ええ、現在取り込んでおりまして――",Dian,,Dian,,Dian
"危機――？
いえ、そういった類のものではございませんが
少々探し物をしておりまして――
それがなかなか見つからず、苦労をしておりました",Dian,,Dian,,Dian
"まさしくこちらの物にございます
覚者様、何とお礼を申し上げたらよいか
この祠の維持に不可欠な物なのです",Dian,,Dian,,Dian
"本当に助かりました――感謝いたします
何やら意図せず騒ぎになっていた様子
ご迷惑をおかけいたしました――",Dian,,Dian,,Dian
