old,english,speaker
やあ、にぎやかだね,,Rondejeel
"この人々がざわめく感じ
目を閉じていても感じる温かな気配――
久しぶりなものでね",,Rondejeel
"せっかくだから、リングディールにも
何かお土産を持って帰りたいな",,Rondejeel
"神殿はいつもこんな感じなのかい？
それとも、今日は特別？",,Rondejeel
"これがチョコレートケーキか――
ありがとう、とても鮮烈な香りだ
ディナンに持って帰って
落ち着いて食べることにするよ",,Rondejeel
"うん、リングディールへのお土産も
何かお菓子にすることにしよう
だって、これには君の気持ちがこもってるんだろう？
それなら、僕だけが大切にいただかないとね",,Rondejeel
"――君も毎日忙しいとは思うけど
息抜きがしたくなったら森に来てくれ
いつでも歓迎するよ",,Rondejeel
"様子がおかしいけど
どうかしたのかい？",,Rondejeel
"ううん、できたら貰って帰りたいところだけど――
君が人に贈ることができるのは
“一人だけ”に“一つだけ”なんだろう？",,Rondejeel
