old,english,speaker
さっきからワクワクが止まらないよ！,,Carrie
"酒場にテラスがあるって素敵！
外の風を感じながら食べたり
飲んだりできたら、いい気分転換になるよね",,Carrie
"あとでここのメニューを見せて
もらわなくちゃ！
珍しい料理があったら
自分でも作ってみたいもん",,Carrie
"ねぇねぇ、ここでいつも
どんな過ごし方をしてるの？
――そこにいる吟遊詩人の歌を聞きながら
皆で踊ったりするの？",,Carrie
"ほ、ほんとにアタシにくれるの！？
誰か一人にしかあげられないんでしょ？
――嬉しい！！　すっごく嬉しいよ！",,Carrie
"今、ちょっとだけ味見してもいい？
――あっ、表面はとろけて
中見はずっしりまったりしてる！
贅沢な材料で作りましたって感じ",,Carrie
"これは良いお茶と一緒に
味わって食べないと勿体ないヤツだね！
美味しいお菓子をありがとう！",,Carrie
"んー、何だろな～
気になるなぁ",,Carrie
"あっ、待って待って！
“一人”に“一回だけ”がルールなんでしょ？
こういうのってルールちゃんと守らないと
楽しさが半減しちゃうからさ、ね？",,Carrie
